<?xml version="1.0" encoding="UTF-8"?>
<clientes xmlns:xsi="http://www.w3.org/2001/XMLSchema-instance"
    xsi:noNamespaceSchemaLocation="clientes.xsd">
    <sede codigo="A0007891">
        <direccion></direccion>
        <direccion></direccion>
        <empleado></empleado>
        <Fecha></Fecha>
        <Descripcion></Descripcion>
        <codcliente codigo="AAA-456">
            <numero></numero>
            <coste></coste>
            <resumen></resumen>
            <plazo></plazo>
        </codcliente>
        <codcliente codigo="AAA-457">
            <numero></numero>
            <coste></coste>
            <resumen></resumen>
            <plazo></plazo>
        </codcliente>
    </sede>
</clientes>